<?xml version="1.0" encoding="UTF-8"?>
<!--
/**
 * Copyright Â© 2013-2017 Magento, Inc. All rights reserved.
 * See COPYING.txt for license details.
 */
-->
<map xmlns:xs="http://www.w3.org/2001/XMLSchema-instance" xs:noNamespaceSchemaLocation="../../../../../etc/map.xsd">
    <source>
        <document_rules>
            <rename>
                <document>sales_flat_order</document>
                <to>sales_order</to>
            </rename>
        </document_rules>
        <field_rules>
            <ignore>
                <field>sales_flat_order.reward_points_balance_refunded</field>
            </ignore>
            <ignore>
                <field>sales_flat_order.reward_salesrule_points</field>
            </ignore>
        </field_rules>
    </source>
    <destination />
</map>
